{
  "schemaVersion": 2,
  "meta": {
    "title": "Planning Nexus Réussite 2026-2027",
    "updatedAt": "2026-09-03",
    "source": "planning initial 2026-2027 (v1 migré)"
  },
  "settings": {
    "academicYear": "2026-2027",
    "title": "Planning Nexus Réussite 2026-2027",
    "dayStart": "08:00",
    "dayEnd": "22:00",
    "slotMinutes": 15,
    "normalSimultaneous": 2,
    "maxSimultaneous": 3,
    "lateThreshold": "21:30",
    "lunchBreak": {
      "start": "13:15",
      "end": "14:45"
    },
    "waitLightMinutes": 45,
    "waitStrongMinutes": 90,
    "amplitudeWarnMinutes": 600,
    "suggestedSlots": [
      {
        "start": "09:00",
        "end": "11:00"
      },
      {
        "start": "11:15",
        "end": "13:15"
      },
      {
        "start": "14:45",
        "end": "16:45"
      },
      {
        "start": "17:00",
        "end": "19:00"
      },
      {
        "start": "19:15",
        "end": "21:15"
      }
    ]
  },
  "teachers": [
    {
      "id": "teacher-m1",
      "code": "M1",
      "name": "Enseignant Maths / NSI — Scolarisés",
      "subjects": [
        "MATHS",
        "NSI",
        "EAM"
      ],
      "color": "#0B1F3A",
      "active": true,
      "unavailability": [],
      "notes": ""
    },
    {
      "id": "teacher-m2",
      "code": "M2",
      "name": "Enseignant Maths / NSI — Candidats individuels",
      "subjects": [
        "MATHS",
        "NSI",
        "EAM"
      ],
      "color": "#2457C5",
      "active": true,
      "unavailability": [],
      "notes": ""
    },
    {
      "id": "teacher-f1",
      "code": "F1",
      "name": "Enseignante Français / Philosophie",
      "subjects": [
        "FRANCAIS",
        "PHILO",
        "GRAND_ORAL"
      ],
      "color": "#B3261E",
      "active": true,
      "unavailability": [],
      "notes": ""
    },
    {
      "id": "teacher-pc",
      "code": "PC",
      "name": "Enseignant Physique-Chimie",
      "subjects": [
        "PC"
      ],
      "color": "#0E7C9B",
      "active": true,
      "unavailability": [],
      "notes": ""
    },
    {
      "id": "teacher-svt",
      "code": "SVT",
      "name": "Enseignant SVT",
      "subjects": [
        "SVT"
      ],
      "color": "#2E7D32",
      "active": true,
      "unavailability": [],
      "notes": ""
    },
    {
      "id": "teacher-ses",
      "code": "SES",
      "name": "Enseignant SES",
      "subjects": [
        "SES"
      ],
      "color": "#B7791F",
      "active": true,
      "unavailability": [],
      "notes": ""
    },
    {
      "id": "teacher-hg",
      "code": "HG",
      "name": "Enseignant HGGSP / Histoire-Géo / EMC",
      "subjects": [
        "HGGSP",
        "HG_EMC"
      ],
      "color": "#C2571B",
      "active": true,
      "unavailability": [],
      "notes": ""
    },
    {
      "id": "teacher-lv",
      "code": "LV",
      "name": "Enseignant Langues vivantes",
      "subjects": [
        "LANGUES"
      ],
      "color": "#0F766E",
      "active": true,
      "unavailability": [],
      "notes": ""
    },
    {
      "id": "teacher-es",
      "code": "ES",
      "name": "Enseignant Enseignement scientifique",
      "subjects": [
        "ENS_SCI"
      ],
      "color": "#4D7C0F",
      "active": true,
      "unavailability": [],
      "notes": ""
    },
    {
      "id": "teacher-etude",
      "code": "ETUDE",
      "name": "Encadrement étude",
      "subjects": [
        "ETUDE"
      ],
      "color": "#64748B",
      "active": true,
      "unavailability": [],
      "notes": ""
    }
  ],
  "rooms": [
    {
      "id": "room-1",
      "name": "Salle 1",
      "capacity": 6,
      "exceptional": false,
      "active": true,
      "notes": ""
    },
    {
      "id": "room-2",
      "name": "Salle 2",
      "capacity": 6,
      "exceptional": false,
      "active": true,
      "notes": ""
    },
    {
      "id": "room-3",
      "name": "Salle 3",
      "capacity": 6,
      "exceptional": true,
      "active": true,
      "notes": ""
    }
  ],
  "subjects": [
    {
      "id": "MATHS",
      "label": "Mathématiques",
      "short": "Maths",
      "color": "#2457C5",
      "levels": [
        "QUATRIEME",
        "TROISIEME",
        "SECONDE",
        "PREMIERE",
        "TERMINALE"
      ],
      "active": true
    },
    {
      "id": "NSI",
      "label": "Numérique et sciences informatiques",
      "short": "NSI",
      "color": "#5B3FB8",
      "levels": [
        "PREMIERE",
        "TERMINALE"
      ],
      "active": true
    },
    {
      "id": "FRANCAIS",
      "label": "Français / EAF",
      "short": "Français",
      "color": "#B3261E",
      "levels": [
        "QUATRIEME",
        "TROISIEME",
        "SECONDE",
        "PREMIERE"
      ],
      "active": true
    },
    {
      "id": "PHILO",
      "label": "Philosophie",
      "short": "Philo",
      "color": "#7A2E6B",
      "levels": [
        "TERMINALE"
      ],
      "active": true
    },
    {
      "id": "PC",
      "label": "Physique-Chimie",
      "short": "PC",
      "color": "#0E7C9B",
      "levels": [
        "PREMIERE",
        "TERMINALE"
      ],
      "active": true
    },
    {
      "id": "SVT",
      "label": "SVT",
      "short": "SVT",
      "color": "#2E7D32",
      "levels": [
        "PREMIERE",
        "TERMINALE"
      ],
      "active": true
    },
    {
      "id": "SES",
      "label": "SES",
      "short": "SES",
      "color": "#B7791F",
      "levels": [
        "PREMIERE",
        "TERMINALE"
      ],
      "active": true
    },
    {
      "id": "HGGSP",
      "label": "HGGSP",
      "short": "HGGSP",
      "color": "#C2571B",
      "levels": [
        "PREMIERE",
        "TERMINALE"
      ],
      "active": true
    },
    {
      "id": "HG_EMC",
      "label": "Histoire-Géographie / EMC",
      "short": "HG/EMC",
      "color": "#8A5A2B",
      "levels": [
        "PREMIERE",
        "TERMINALE"
      ],
      "active": true
    },
    {
      "id": "EAM",
      "label": "Mathématiques anticipées / EAM",
      "short": "EAM",
      "color": "#1F6FB2",
      "levels": [
        "PREMIERE"
      ],
      "active": true
    },
    {
      "id": "LANGUES",
      "label": "Langues vivantes A / B",
      "short": "LVA/LVB",
      "color": "#0F766E",
      "levels": [
        "PREMIERE",
        "TERMINALE"
      ],
      "active": true
    },
    {
      "id": "ENS_SCI",
      "label": "Enseignement scientifique",
      "short": "Ens. sci.",
      "color": "#4D7C0F",
      "levels": [
        "PREMIERE",
        "TERMINALE"
      ],
      "active": true
    },
    {
      "id": "GRAND_ORAL",
      "label": "Grand Oral / expression",
      "short": "Grand Oral",
      "color": "#9F1239",
      "levels": [
        "TERMINALE"
      ],
      "active": true
    },
    {
      "id": "ETUDE",
      "label": "Étude encadrée / devoirs",
      "short": "Étude",
      "color": "#64748B",
      "levels": [],
      "active": true
    }
  ],
  "groups": [
    {
      "id": "P1-CL",
      "label": "Candidats individuels",
      "level": "PREMIERE",
      "audience": "CL",
      "variant": null,
      "notes": ""
    },
    {
      "id": "T-CL",
      "label": "Candidats individuels",
      "level": "TERMINALE",
      "audience": "CL",
      "variant": null,
      "notes": ""
    },
    {
      "id": "4E-SCO",
      "label": "Scolarisés",
      "level": "QUATRIEME",
      "audience": "SCO",
      "variant": null,
      "notes": ""
    },
    {
      "id": "3E-SCO",
      "label": "Scolarisés",
      "level": "TROISIEME",
      "audience": "SCO",
      "variant": null,
      "notes": ""
    },
    {
      "id": "2DE-SCO",
      "label": "Scolarisés",
      "level": "SECONDE",
      "audience": "SCO",
      "variant": null,
      "notes": ""
    },
    {
      "id": "T-SCO-A",
      "label": "Maths A",
      "level": "TERMINALE",
      "audience": "SCO",
      "variant": "A",
      "notes": "Parcours Maths A : priorité au profil Maths + NSI (enchaînement Maths → NSI)."
    },
    {
      "id": "P1-SCO",
      "label": "Scolarisés",
      "level": "PREMIERE",
      "audience": "SCO",
      "variant": null,
      "notes": ""
    },
    {
      "id": "T-SCO-B",
      "label": "Maths B",
      "level": "TERMINALE",
      "audience": "SCO",
      "variant": "B",
      "notes": "Parcours Maths B : priorité au profil Maths + Physique-Chimie (enchaînement Maths → PC)."
    },
    {
      "id": "P1-SCO-A",
      "label": "Maths A",
      "level": "PREMIERE",
      "audience": "SCO",
      "variant": "A",
      "notes": "Parcours Maths A : priorité au profil Maths + NSI (enchaînement Maths → NSI)."
    },
    {
      "id": "T-SCO",
      "label": "Scolarisés",
      "level": "TERMINALE",
      "audience": "SCO",
      "variant": null,
      "notes": ""
    },
    {
      "id": "P1-SCO-B",
      "label": "Maths B",
      "level": "PREMIERE",
      "audience": "SCO",
      "variant": "B",
      "notes": "Parcours Maths B : priorité au profil Maths + Physique-Chimie (enchaînement Maths → PC)."
    }
  ],
  "sessions": [
    {
      "id": "MON-1730-P1-EAM",
      "day": "MON",
      "start": "17:30",
      "end": "19:30",
      "audience": "CL",
      "level": "PREMIERE",
      "subjectId": "EAM",
      "groupId": "P1-CL",
      "teacherId": "teacher-m2",
      "roomId": "room-1",
      "title": "Première CL — Maths anticipées / EAM",
      "active": true,
      "notes": ""
    },
    {
      "id": "MON-1730-T-HG",
      "day": "MON",
      "start": "17:30",
      "end": "19:30",
      "audience": "CL",
      "level": "TERMINALE",
      "subjectId": "HG_EMC",
      "groupId": "T-CL",
      "teacherId": "teacher-hg",
      "roomId": "room-2",
      "title": "Terminale CL — Histoire-Géo / EMC",
      "active": true,
      "notes": ""
    },
    {
      "id": "MON-1945-P1-HG",
      "day": "MON",
      "start": "19:45",
      "end": "21:45",
      "audience": "CL",
      "level": "PREMIERE",
      "subjectId": "HG_EMC",
      "groupId": "P1-CL",